Name,TOL Tradition ID,BDRC T ID,Wylie Name,Chinese,Wikidata ID,Parent,Founder Name,Founder TOL ID,Founder BDRC ID,Description,Notes
Taklung Kagyu,TOL45,T869,stag lung bka' brgyud,,Q2388143,Marpa Kagyu,Taklungtangpa Tashi Pel,TOLP4368,P2649,"<p> The Taklung Kagyu tradition was established by <a href=""/biographies/view/Taklungtangpa-Tashi-Pel-/TBRC_P2649"">Taklungtangpa Tashi Pel</a>, a disciple of <a href=""/biographies/view/Pakmodrupa-Dorje-Gyelpo/TBRC_P127"">Pakmodrupa Dorje Gyelpo</a>, who founded&nbsp;<a href=""/geographies/view/Taklung-Monastery/TBRC_G67"">Taklung Monastery</a> in 1180. In 1276 <a href=""/biographies/view/Sanggye-Won/TBRC_P1019"">Sanggye Won</a>, who was forced from the abbacy of Taklung Monastery, went to Kham and established <a href=""/geographies/view/Riwoche/TBRC_G1019"">Riwoche</a>, which became a second seat of the tradition.Beginning in the fifteenth century, Taklung Kagyu began to be strongly influenced by Nyingma teachings.</p>",
Tropu Kagyu,TOL1034,T2MS13225,khro phu bka' brgyud,,Q2429665,Marpa Kagyu,Tropu Gyeltsa Rinchen Gon,TOLP2799,P1508,"<p> The Tropu Kagyu tradition, one of the eight minor Kagyu lineages, was founded by&nbsp;<a href=""/biographies/view/Gyaltsa-Rinchen-Gonpo/TBRC_P1508"">Gyeltsa Rinchen Gonpo</a>, a disciple of <a href=""/biographies/view/Pakmodrupa/TBRC_P127"">Pakmodrupa</a>, in the twelfth century. Rinchen Gonpo founded <a href=""/geographies/view/Tropu/TBRC_G279"">Tropu</a> monastery, which became the seat of the tradition.&nbsp;The acclaimed translator <a href=""/biographies/view/Tropu-Lotsawa-Jampa-Pel/TBRC_P4007"">Tropu Lotsāwa Jampa Pel</a>, Rinchen Gonpo's nephew, would eventually establish the Tropu Kagyu as a distinct lineage.</p>",
Tselpa Kagyu,TOL17,T1387,tshal pa bka' brgyud,維基媒體分類,Q86807211,Marpa Kagyu,Zhang Yudrakpa Tsondru Drakpa,TOLP3182,P1857,"<p> The Tselpa Kagyu tradition, one of the four major lineages of the Kagyu tradition, was founded in the twelfth century by <a href=""/biographies/view/Zhang-Yudrakpa-Tsondru-Drakpa/TBRC_P1857"">Zhang Yudrakpa</a>, also known as Lama Zhang. The seat was at <a href=""/geographies/view/Tsel-Guntang/TBRC_G30"">Tsel Guntang</a>, north of Lhasa.&nbsp; Important figures include <a href=""/biographies/view/Dungtso-Repa-Sherap-Gyeltsen/TBRC_P1801"">Dungtso Repa Sherap Gyeltsen</a> who revealed teachings of <a href=""/biographies/view/Gampopa/TBRC_P1844"">Gampopa</a>. The tradition was absorbed by the Geluk school in the fifteenth century and its monasteries were converted.&nbsp;</p>",
Yabzang Kagyu,TOL1130,T2MS13229,g.ya' bzang bka' brgyud,,,Marpa Kagyu,Zarawa Kelden Yeshe Sengge,TOLP6756,P4329,"<p> The Yabzang Kagyu, one of the eight minor Kagyu lineages, was founded in the twelfth century by <a href=""/biographies/view/Pakmodrupa/TBRC_P127"">Pakmodrupa</a>'s disciple <a href=""/biographies/view/Zarawa-Kelden-Yeshe-Sengge/TBRC_P4329"">Zarawa Kelden Yeshe Sengge</a>, whose student <a href=""/biographies/view/Yabzang-Choje-Chokyi-Monlam/TBRC_P4322"">Yabzang Choje Chokyi Monlam</a> systematized the teachings of Zarawa to form the basis of the tradition. <a href=""/geographies/view/Yabzang/TBRC_G444"">Yabzang</a> and <a href=""/geographies/view/Zara/TBRC_G00AG02483"">Zara</a> were important Yabzang Kagyu monasteries. Neither monasteries flourished for very long, and the Yabzang Kagyu teachings were absorbed into other traditions.</p>",
Yelpa Kagyu,TOL28,T1186,yel pa bka' brgyud,,Q2600040,Marpa Kagyu,Yelpa Yeshe Tsek,TOLP7636,P5132,"<p> The Yelpa Kagyu tradition was established by <a href=""/biographies/view/Yelpa-Yeshe-Tsek/TBRC_P5132"">Yelpa Yeshe Tsek</a>, a disciple of <a href=""/biographies/view/Pakmodrupa/TBRC_P127"">Pakmodrupa</a>. It thus counts as on of the ""minor branches"" in that it stems from the students of Pakmodrupa rather than <a href=""/biographies/view/Gampopa/TBRC_p1844"">Gampopa</a>. Yeshe Tsek established multiple monasteries, chief among them being <a href=""/geographies/view/Shar-Yelpuk/TBRC_g488"">Shar Yelpuk</a> in 1171, which served as the seat of the tradition.</p>",
Zhije and Chod,TOL710,T194,zhi byed dang gcod,施身法,Q516265,,"Padampa Sanggye, Machik Labdron","TOLP5644, TOLP2510","P3312, P1243","<p> The Zhije (<em>zhi byed</em>) and Chod (<em>gcod</em>) lineages weave in and out of almost all institutionally independent traditions of Tibetan Buddhism, although they themselves never became the established dominant tenet system of any monastery. The Zhije lineage in Tibet originated with the Indian master <a href=""/biographies/view/Padampa-Sanggye/TBRC_p1243"">Padampa Sanggye</a>, who is said to have visited Tibet five times. He had a number of disciples in the Tingri area of Tibet, to whom he taught his method of pacifying suffering. Padampa Sanggye also taught a method for cutting through demonic obstruction to his relative <a href=""/biographies/view/Kyoton-Sonam-Lama/TBRC_P3311"">Kyoton Sonam Lama</a>, who transmitted it to <a href=""/biographies/view/Machik-Labdron/TBRC_P3312"">Machik Labdron</a>. Her lineage of Chod, which she passed down to her children, came to be known as “Mother Chod” in contrast to the lineage stemming from Padampa Sanggye, which is known as “Father Chod.” Additional Chod developed, including one stemming from treasure revelations (“Treasure Chod”), the Gyeltang Chod, stemming from Machik Labdron’s disciple <a href=""/biographies/view/Gyeltang-Samten-Ozer/TBRC_P8756"">Gyeltang Samten Ozer</a>, and the Zurmang Chod, transmitted by Rangjung Zhabla Ngawa.</p>",